{"run":37,"commit":"9b8fc47","metric":1438.805,"metrics":{"pebble_writepack_100k_ms":157.806,"pebble_writepack_10k_ms":27.067,"pebble_writepack_1k_ms":9.901,"pebble_writepack_100_ms":7.145,"pebble_writepack_1m_bytes_op":1994054780,"pebble_writepack_1m_allocs_op":3021520,"pebble_readpaginated_100k_ms":128.676,"pebble_readpaginated_1k_ms":3.867,"pebble_writegrant_solo_ns_op":17151,"codec_direct_ns_op":466,"codec_reflect_ns_op":1358,"sqlite_writepack_1k_ms":29.06},"status":"discard","description":"FlushSplitBytes 2 MiB \\u2192 64 MiB. Bigger jump than #21 (\\u219216 MiB) and #31 (\\u219216 MiB at the lower baseline). Primary +1.3% mild regression, secondaries flat. Larger SSTs reduce per-file metadata overhead but each is now monolithic to write/checkpoint \\u2014 either Pebble doesn't honor very large hints or the savings are offset by less write parallelism within the flusher.","timestamp":1779698107557,"segment":0,"confidence":4.071298445188904,"asi":{"hypothesis":"265 small L0 SSTs (with 2 MiB FlushSplitBytes) creates checkpoint hard-link + tar overhead; bumping to 64 MiB would yield ~9 SSTs and reduce per-file work substantially.","result":"primary +1.3% (mild regression direction), all secondaries within noise.","rollback_reason":"no improvement.","mechanism_failure":"FlushSplitBytes is documented as 'suggested' — Pebble may split differently than the hint requests. Or: bigger SSTs are more monolithic to flush, losing within-flusher parallelism. Or: file count reduction (265→9) saves less than I estimated because the per-file syscall overhead is small on a modern fs / page-cache-hot path.","next_action_hint":"FlushSplitBytes axis is fully explored — 2, 16, 64 MiB all neutral-to-mildly-negative. Skip it. Remaining options I haven't tried: (a) reduce GC scan via proto pooling (risky), (b) profile-guided look at what blocks during EndSync+Close (need block profile), (c) accept the plateau at -67%."}}
{"run":38,"commit":"9b8fc47","metric":1421.342,"metrics":{"pebble_writepack_100k_ms":160.84,"pebble_writepack_10k_ms":27.395,"pebble_writepack_1k_ms":9.552,"pebble_writepack_100_ms":6.985,"pebble_writepack_1m_bytes_op":2007958500,"pebble_writepack_1m_allocs_op":3022425,"pebble_readpaginated_100k_ms":132.978,"pebble_readpaginated_1k_ms":3.852,"pebble_writegrant_solo_ns_op":16702,"codec_direct_ns_op":448,"codec_reflect_ns_op":562,"sqlite_writepack_1k_ms":28.302},"status":"discard","description":"WALBytesPerSync = 4 MiB. Spreads WAL fsync work across the write phase in a background goroutine, theoretically reducing the EndFreshSync.LogData(Sync) wait at the end. Primary flat (+0.1%), all secondaries flat or within noise.","timestamp":1779698516187,"segment":0,"confidence":4.138105095093964,"asi":{"hypothesis":"With NoSync writes accumulating ~650 MB of un-fsync'd WAL, the final LogData(Sync) at EndFreshSync is a big fsync. WALBytesPerSync triggers background partial fsyncs every 4 MiB, so the final fsync has less work.","result":"primary flat, no signal at any scale.","rollback_reason":"no measurable benefit.","mechanism_failure":"Two plausible reasons: (a) on a fast SSD or tmpfs-backed /tmp, the final fsync was already cheap (~10–30 ms) and there's no real gap to compress. (b) The background fsync goroutines compete with the parallel-build writes for disk bandwidth — spreading the cost out doesn't save any wallclock when the disk is the bottleneck.","next_action_hint":"Disk-fsync axis seems irrelevant on this hardware. Most remaining ideas are exhausted or below noise. We are at a real plateau (-66.9%) at this bench precision (-benchtime=2x). Future progress requires either: (1) longer benchtime for sub-noise discrimination, (2) deferred structural changes (proto pool, codec codegen, SST ingest path), or (3) accept the plateau as the loop's practical floor."}}
{"run":39,"commit":"9b8fc47","metric":1432.409,"metrics":{"pebble_writepack_100k_ms":158.646,"pebble_writepack_10k_ms":26.455,"pebble_writepack_1k_ms":9.929,"pebble_writepack_100_ms":7.213,"pebble_writepack_1m_bytes_op":1989851648,"pebble_writepack_1m_allocs_op":3022007,"pebble_readpaginated_100k_ms":130.475,"pebble_readpaginated_1k_ms":3.554,"pebble_writegrant_solo_ns_op":16713,"codec_direct_ns_op":465,"codec_reflect_ns_op":1347,"sqlite_writepack_1k_ms":28.563},"status":"discard","description":"4-way loser tournament tree for the k-way merge, replacing the naive linear scan. Asymptotically log\\u2082(k)=2 cmps per advance vs naive k-1=3 cmps, theoretical ~60 ms save at 2M iterations. Primary +0.9% (flat, slight regression direction); all secondaries within noise. Modern CPU branch prediction makes naive 4-way scan competitive with the tournament for k=4.","timestamp":1779698996573,"segment":0,"confidence":4.20714080611324,"asi":{"hypothesis":"naive 4-way merge does 3 cmps per output (find min of 4) for 2M outputs = 6M cmps total. Tournament tree does log₂(4) = 2 cmps per advance (replay path from leaf to root) for 4M cmps total. Save ~2M cmps × 30 ns = ~60 ms.","result":"primary +0.9% flat. 10k -5.7% (within noise). No meaningful improvement.","rollback_reason":"no signal at primary metric.","mechanism_failure":"For k=4, the naive scan is highly branch-predictable — modern CPUs predict the 4-iteration loop perfectly. The bytes.Compare's cmpbody is SIMD'd and largely fixed-cost. The tournament tree adds: (a) more variable branching (which path up the tree), (b) extra memory accesses (tree[] array), (c) more complex drained-stream handling. These overheads roughly cancel the cmp savings. Tournament trees pay off at k≥8 where the branching advantage is meaningful; k=4 is in the sweet spot for naive linear scan.","cumulative_progress":"Cumulative remains -66.9% from RFC baseline (4292→1420 ms at 1M). 12 wins kept across 39 experiments.","next_action_hint":"Algorithmic optimization within the merge is exhausted at k=4. To win more here we'd need k≥8 — but more shards have their own cost (more arenas, sort overhead). The serial merge IS what it is at our scale."}}
{"run":40,"commit":"9b8fc47","metric":1459.771,"metrics":{"pebble_writepack_100k_ms":161.575,"pebble_writepack_10k_ms":26.615,"pebble_writepack_1k_ms":9.799,"pebble_writepack_100_ms":7.27,"pebble_writepack_1m_bytes_op":1989935264,"pebble_writepack_1m_allocs_op":3022002,"pebble_readpaginated_100k_ms":131.523,"pebble_readpaginated_1k_ms":3.59,"pebble_writegrant_solo_ns_op":15623,"codec_direct_ns_op":445.5,"codec_reflect_ns_op":1301,"sqlite_writepack_1k_ms":28.478},"status":"discard","description":"Custom comparator `idxKeySharedSyncCompare` that skips 23 bytes of common prefix (versionV3 + typeIndex + idxByte + 20-byte sync_id) for keys known to share a sync_id. Used in sort and merge of the parallel skipGet path. Primary +2.8% \\u2014 REGRESSION. The wrapper-function overhead and slice header reconstruction cost more than skipping 23 bytes saves \\u2014 bytes.Compare's cmpbody is so SIMD-tight that adding intermediate function calls is a net loss.","timestamp":1779699622369,"segment":0,"confidence":3.9842045678419704,"asi":{"hypothesis":"All idx keys within a single PutGrantRecords call share a 23-byte prefix (v3 + typeIndex + idxByte + sync_id). Skipping that prefix in comparisons saves ~10 ns per cmp (one SIMD chunk). At ~46M cmps total (parallel sort + serial merge), save ~460 ms CPU = ~100 ms wallclock.","result":"primary +2.8% REGRESSION. Save did not materialise; opposite happened.","rollback_reason":"primary regressed clearly above noise.","mechanism_failure":"Three compounding overheads from the wrapper: (1) function-call cost (Go may not inline conditional + multi-line function), (2) two slice header reconstructions per call (a[idxKeySyncPrefixLen:], b[idxKeySyncPrefixLen:]) — each slice op is ~1-2 ns but accumulates over millions of calls, (3) the byte-2 branch (a[2] != b[2]) is rarely taken (most pairs are same idx type until the very boundary), so branch predictor mostly works but the comparison itself adds an extra check. bytes.Compare's cmpbody is a single SIMD-tight assembly routine — wrapping it with anything in Go costs more than it saves at this scale.","general_lesson":"Modern SIMD'd memcmp is so fast that 'skip N bytes' optimizations rarely pay off in Go unless N is large (hundreds of bytes) AND the wrapper inlines. For 23 bytes saved at the cost of a Go function call, the wrapper loses.","next_action_hint":"Both algorithmic merge optimizations (tournament tree #39, prefix-skip #40) have failed for similar reasons — the naive bytes.Compare path is optimally cache- and SIMD-friendly. The merge isn't actually the bottleneck I thought. Time to consider this axis truly exhausted."}}
{"run":41,"commit":"d919128","metric":1352.325,"metrics":{"pebble_writepack_100k_ms":150.382,"pebble_writepack_10k_ms":27.352,"pebble_writepack_1k_ms":9.638,"pebble_writepack_100_ms":7.067,"pebble_writepack_1m_bytes_op":1974148604,"pebble_writepack_1m_allocs_op":22014,"pebble_readpaginated_100k_ms":133.221,"pebble_readpaginated_1k_ms":3.795,"pebble_writegrant_solo_ns_op":16117,"codec_direct_ns_op":441.5,"codec_reflect_ns_op":1375,"sqlite_writepack_1k_ms":29.688},"status":"keep","description":"Replace V2GrantToV3's per-grant builder allocations with a per-call grantTranslateArena (3 pre-sized slices for GrantRecord/EntitlementRef/PrincipalRef). writepack_1m 1420\\u21921352 ms (-4.8%). writepack_100k 158\\u2192150 ms (-4.8%, same direction confirms). Allocs/op 3.02M\\u219222K (-99.3%). Mechanism: proto Set* methods are simple field assignments, not builder-pattern dependent. The arena's contiguous backing arrays mean GC sees 3 large objects per PutGrants call instead of 3M small ones; scanObjectsSmall time drops proportionally. Pointers into the pre-sized slices are stable (no reallocation since cap = len(grants)). SQLite sentinel +4.2% is run-to-run noise (no SQLite code changed).","timestamp":1779700317922,"segment":0,"confidence":3.873103355591511,"asi":{"hypothesis":"V2GrantToV3 allocates 3 proto structs per grant via Build() (GrantRecord, EntitlementRef, PrincipalRef). For N=1M that's 3M heap objects, which dominates the engine's GC scan during the parallel build phase (~440 ms scanObjectsSmall CPU per profile). An arena of 3 pre-sized slices collapses 3M allocations to 3.","result":"primary -4.8% (1420→1352 ms). Allocs/op 3.02M→22K (-99.3%) — essentially eliminated the per-grant tax. 100k -4.8% (same direction at independent scale confirms not noise).","mechanism_insight":"Two compounding factors: (1) GC scanObjectsSmall walks each live heap object; 3M→22K = 137x reduction in scan work. (2) Cache locality: contiguous slice arrays have better access patterns than scattered heap allocations during proto.Marshal traversal. (3) Allocator pressure: fewer make([]X) calls = less allocator bookkeeping.","cumulative_progress":"4291.9 ms → 1352.3 ms = -68.5% from RFC baseline. Thirteen compounding wins.","safety_verification":"All tests pass: engine + adapter + compactor + equivalence + envelope tests + the property-based translate_v2 round-trip test. The proto-generated Set* methods are simple field writes that don't care about the struct's storage location. Pointers into pre-sized slices are stable because we never grow past initial capacity.","small_workload_neutral":"writepack_100/1k are flat — expected: the arena's overhead (3 slice allocs, ~120 bytes total) is negligible at any size, and the GC benefit only matters when N is large enough for many objects to be alive simultaneously.","production_value":"This is a general production optimization, not bench-specific. Any bulk PutGrants call benefits proportionally to its grant count. Doesn't change semantics, durability, or any other contract.","next_action_hint":"The pattern transfers to PutResources / PutEntitlements / PutResourceTypes — but those aren't measured by this bench. Could apply for transferable production wins, but loop rule says only keep if primary moves. Worth noting as a follow-up. Also: adapter_grants_store.go's PutGrantsIfNewer uses the same V2GrantToV3 pattern; could optimize there too."}}
{"run":42,"commit":"d4b7e29","metric":1317.685,"metrics":{"pebble_writepack_100k_ms":146.251,"pebble_writepack_10k_ms":26.314,"pebble_writepack_1k_ms":9.771,"pebble_writepack_100_ms":6.877,"pebble_writepack_1m_bytes_op":1975980988,"pebble_writepack_1m_allocs_op":21506,"pebble_readpaginated_100k_ms":133.871,"pebble_readpaginated_1k_ms":3.656,"pebble_writegrant_solo_ns_op":16822,"codec_direct_ns_op":504,"codec_reflect_ns_op":1370,"sqlite_writepack_1k_ms":27.589},"status":"keep","description":"Parallelize the V2\\u2192V3 grant translation in Adapter.PutGrants with 4 shard workers, each writing to a disjoint range of the records slice with its own arena. Previously this 1M-iteration loop ran serially in the adapter goroutine BEFORE the engine spawned its parallel build phase \\u2014 \\u2248140 ms wallclock of single-threaded work blocking the parallel work that follows. writepack_1m 1352\\u21921318 ms (-2.6%). writepack_100k 150\\u2192146 (-2.6% same direction confirms). All scales improved or flat; SQLite sentinel within noise (no SQL code changed). Threshold of 1024 records per shard keeps small calls on the serial path.","timestamp":1779700785097,"segment":0,"confidence":4.298020078121725,"asi":{"hypothesis":"The adapter's serial V2→V3 translation loop (1M iterations × ≈140 ns/op ≈ 140 ms wallclock) runs single-threaded before the engine's parallel build phase. Profile shows translateV2Grant at 140 ms flat. Sharding to 4 workers would save ≈70 ms wallclock minus goroutine setup overhead.","result":"primary -2.6% (1352→1318 ms), ≈34 ms save. 100k also -2.6% confirms.","actual_vs_predicted":"Saved 34 ms vs predicted 70 ms. Two factors: (1) goroutine setup + sync.WaitGroup overhead eats ~10 ms, (2) the post-translation compaction pass (filtering nil slots) re-runs serially — ≈5 ms. The translation itself parallelized well; the surrounding glue cost ≈30 ms net.","cumulative_progress":"4291.9 ms → 1317.7 ms = -69.3% from RFC baseline. Fourteen compounding wins.","small_workload_safety":"Threshold of 1024 records per shard (= 4096 grants total) keeps small calls on the serial path. writegrant_solo +4% within noise; writepack_100/1k flat or improved. Parallel cost is bounded.","production_value":"General optimization — any bulk PutGrants call larger than 4K grants benefits. Not bench-specific.","next_action_hint":"The pattern (per-shard arena + parallel translation) applies cleanly to PutResources / PutEntitlements / PutResourceTypes too. Bench doesn't measure those, so by loop rules they'd be discards. Could batch them as one commit for production value (still won't move bench primary). Profile to find next bottleneck."}}
{"run":43,"commit":"d4b7e29","metric":1352.734,"metrics":{"pebble_writepack_100k_ms":145.972,"pebble_writepack_10k_ms":26.408,"pebble_writepack_1k_ms":9.741,"pebble_writepack_100_ms":6.967,"pebble_writepack_1m_bytes_op":2166017088,"pebble_writepack_1m_allocs_op":22119,"pebble_readpaginated_100k_ms":131.553,"pebble_readpaginated_1k_ms":3.761,"pebble_writegrant_solo_ns_op":15126,"codec_direct_ns_op":485,"codec_reflect_ns_op":558.5,"sqlite_writepack_1k_ms":28.133},"status":"discard","description":"Pre-read all checkpoint files in parallel (4 workers) before serial tar+zstd writes, intending to overlap I/O syscalls with encoding. writepack_1m 1318\\u21921353 ms (+2.7% REGRESSION). The structure was bulk-read-then-bulk-write (3 phases) which doesn't overlap reads with writes at all. bytes_op +10% from holding all 650 MB simultaneously. Reads were already page-cache hot so parallelism gave no wins, while peak memory pressure hurt.","timestamp":1779701369307,"segment":0,"confidence":4.636463263308203,"asi":{"hypothesis":"syscall6 at 170ms flat suggested file I/O contention; parallel pre-reads via 4 workers would overlap with the tar+zstd encoding work.","result":"primary +2.7% REGRESSION, bytes_op +10%, allocs slightly up.","rollback_reason":"primary regressed clearly above noise.","mechanism_failure":"The implementation has THREE serial phases: (1) walk to enumerate files, (2) parallel read into all slots, (3) serial tar write from buffers. Phase 3 starts only after Phase 2 completes — reads do NOT overlap with writes at all. Just shifted the read work to parallel goroutines without saving wallclock. Compounding loss: holding ~650 MB of pre-read data simultaneously increases GC heap pressure and memory bandwidth pressure during the bench iteration, slowing other concurrent work.","what_would_actually_work":"A streaming pipeline: bounded channel where readers fill ahead by 2–3 files, writer drains in order. Each file's read can overlap with writes of EARLIER files. Memory peak: ~3 × avg-file-size ≈ 6 MB instead of 650 MB. But complexity is high and the savings cap is the read time itself (~50 ms wallclock for page-cache-hot reads), so payoff is modest at best.","next_action_hint":"WriteEnvelope optimization seems hard to crack at this scale. The reads are too fast (page cache) and zstd output is already lean. Skip this axis. Primary alternative: profile-guided look at what's BLOCKING the main goroutine post-PutGrants — likely Pebble's engine.Close waiting for background flush/compact goroutines, which we've tried to parallelize twice already with mixed results."}}
