{"run":28,"commit":"c9ca9a7","metric":1916.063,"metrics":{"pebble_writepack_100k_ms":188.273,"pebble_writepack_10k_ms":37.433,"pebble_writepack_1k_ms":10.215,"pebble_writepack_100_ms":6.739,"pebble_writepack_1m_bytes_op":1815287716,"pebble_writepack_1m_allocs_op":3021986,"pebble_readpaginated_100k_ms":129.086,"pebble_readpaginated_1k_ms":3.476,"pebble_writegrant_solo_ns_op":18102,"codec_direct_ns_op":444.5,"codec_reflect_ns_op":1494,"sqlite_writepack_1k_ms":27.534},"status":"discard","description":"Re-attempt of parallel engine.Close + WriteEnvelope, this time with lint passing. The prior run's apparent 1k/10k gains (-15%/-10%) did NOT replicate \\u2014 second run shows all scales flat. The earlier gains were favorable noise from -benchtime=2x. Primary +1.7% noise. No systematic win. Discard.","timestamp":1779693782742,"segment":0,"confidence":3.1253918515639336,"asi":{"hypothesis":"engine.Close runs in parallel with WriteEnvelope to overlap teardown","result":"no signal in re-run; prior 'gains' were noise","rollback_reason":"primary noise + secondaries flat on re-run — the prior experiment's promising secondaries didn't replicate","noise_floor_calibration":"At -benchtime=2x, secondary metrics vary up to ~10–15% run-to-run for the smaller workloads. This calibration matters for interpreting future results.","loop_convergence":"We've now tried 27 experiments. 8 wins kept totaling -56.1% from RFC baseline. Remaining experiments are within-noise or counterproductive. The bench at 2-iteration -benchtime is hitting its measurement precision floor; further improvements likely need either (a) longer benchtime to reduce noise, (b) architectural changes (codegen, SST ingestion bypass), or (c) acceptance of the current plateau as the practical ceiling."}}
{"run":29,"commit":"a864d68","metric":1655.766,"metrics":{"pebble_writepack_100k_ms":169.344,"pebble_writepack_10k_ms":29.436,"pebble_writepack_1k_ms":10.276,"pebble_writepack_100_ms":7.156,"pebble_writepack_1m_bytes_op":2055449864,"pebble_writepack_1m_allocs_op":5021972,"pebble_readpaginated_100k_ms":130.609,"pebble_readpaginated_1k_ms":3.707,"pebble_writegrant_solo_ns_op":16677,"codec_direct_ns_op":339,"codec_reflect_ns_op":1460,"sqlite_writepack_1k_ms":28.271},"status":"keep","description":"Pre-sort the idxBatch via 4-way parallel sort + k-way merge before Setting entries. writepack_1m 1884→1656ms (-12.1%); 100k -9.1%; 10k -21.4%. The idxBatch's flushable-batch promotion sort over 2M unsorted entries was the largest remaining cost (~630 ms in cmpbody+Less per profile). Each shard goroutine collects ~500k idx keys and slices.SortFunc'es them; main goroutine 4-way merges into idxBatch. With entries inserted in key order, pdqsort early-exits during flushable-batch promotion. Tradeoff: +2M []byte allocations (~+200 MB peak) for the temporary key copies \\u2014 alloc count 3.02M→5.02M (+66%). Bench's SQLite sentinel flat (-0.8%), no read regression.","timestamp":1779694466903,"segment":0,"confidence":3.426472423259296,"asi":{"hypothesis":"The idxBatch flushable-batch promotion sort over 2M unsorted entries (≈630 ms in cmpbody+Less per the v6 profile) is the largest remaining cost. Pre-sorting in our code (4-way parallel slice sort + k-way merge) costs less than the savings.","result":"primary -12.1% (1884→1655), 100k -9.1%, 10k -21.4%. Cumulative -61.4% from RFC baseline.","mechanism_insight":"Pebble's newFlushableBatch calls sort.Sort over the batch's offset table; the offsets reference key bytes in batch data. When we Set entries to the batch in key-sorted order, the offset table is naturally sorted — pdqsort detects this and short-circuits. Saves the full O(N log N) over 2M entries.","cumulative_progress":"4291.9 ms → 1655.8 ms = -61.4% from RFC baseline. Nine compounding wins.","memory_tradeoff":"+2M []byte allocations (~+200 MB peak) for the temporary key slices. bytes_op 1818→2055 (+13%). For memory-constrained environments this matters; could be reduced via an arena (one big []byte + offsets) but the API would be messier. Document as a tradeoff.","10k_outlier_check":"writepack_10k went 37.4→29.4 (-21.4%) which is larger than the noise floor would predict. Possible explanations: (a) the sort time at 10k records was already small but the parallelism overhead now overlaps better with EndSync. (b) noise. The 100k and 1m results (-9% and -12%) are solidly above noise.","generalizability":"This is a general optimization — pre-sorted batch ingestion always benefits Pebble's flushable-batch sort, regardless of workload. Bench-data-specific key distributions don't affect correctness, only the magnitude of speedup (less skew → more sort savings).","production_safety":"Same skipGet preconditions as before — only engages when fresh-sync first call AND records ≥1024 per shard (≥4096 total). Cross-batch atomicity unchanged; bench correctness asserted by paginated total count check in benchmarkRegisteredUnpackReadGrants."}}
{"run":30,"commit":"3d660b9","metric":1538.725,"metrics":{"pebble_writepack_100k_ms":168.761,"pebble_writepack_10k_ms":31.076,"pebble_writepack_1k_ms":10.162,"pebble_writepack_100_ms":7.393,"pebble_writepack_1m_bytes_op":1992321280,"pebble_writepack_1m_allocs_op":3021483,"pebble_readpaginated_100k_ms":132.439,"pebble_readpaginated_1k_ms":3.708,"pebble_writegrant_solo_ns_op":15999,"codec_direct_ns_op":350.5,"codec_reflect_ns_op":1262,"sqlite_writepack_1k_ms":28.687},"status":"keep","description":"Arena-style storage for the parallel idx-key sort. Replaces the 2M individual `make([]byte, 0, 96)` allocations from the prior commit with a per-shard (data []byte, bounds [][2]uint32) pair \\u2014 ~10 GC objects total instead of 2M+. writepack_1m 1656\\u21921539ms (-7.1%). Allocs/op 5.02M\\u21923.02M (-40%). bytes/op 2055\\u21921992 MB (-3%). Sort is also faster because [2]uint32 entries are 8 bytes vs 24-byte slice headers, giving better cache density during pdqsort. Cumulative -64.2% from RFC baseline.","timestamp":1779694916606,"segment":0,"confidence":3.6421033415108943,"asi":{"hypothesis":"GC scanObjectsSmall at 670 ms in the v8 profile was driven by the 2M []byte slices we added for parallel sort. Arena (one []byte data + [][2]uint32 bounds per shard) cuts GC objects from 2M to ~10 per shard. Smaller sort element size ([2]uint32 = 8 B vs []byte header = 24 B) also improves sort cache density.","result":"primary -7.1% (1656→1539ms), allocs -40% as predicted, bytes -3%","mechanism_insight":"Two compounding gains: (1) GC has dramatically less work to scan — the arena's data []byte is one object, the bounds slice another, so per shard we go from 500k tracked objects to 2. (2) slices.SortFunc with [2]uint32 elements packs sort state into 8 bytes per item; the comparator dereferences arena[bounds[i][0]:bounds[i][1]] only when comparing. Better L1/L2 cache utilization during pdqsort's repeated comparisons.","cumulative_progress":"4291.9 ms (RFC baseline) → 1538.7 ms = -64.2%. Ten compounding wins.","10k_minor_regression":"writepack_10k 29.4→31.1 (+5.8%) — within the 10–15% noise floor for that scale. Probably a noise-spike on the prior measurement; this run is closer to expected.","alloc_count_back_to_baseline":"3.02M allocs is exactly the v22 baseline (before the [][]byte sort was added). We got the parallel-sort win without paying the alloc tax.","next_action_hint":"Profile again: GC should be substantially lower. Next candidates might be (a) Pebble's flush phase (still ~500 ms), (b) the c1z pack/zstd phase, (c) proto.Marshal overhead in priBatch. Or call this a great stopping point."}}
{"run":31,"commit":"3d660b9","metric":1538.052,"metrics":{"pebble_writepack_100k_ms":165.132,"pebble_writepack_10k_ms":30.267,"pebble_writepack_1k_ms":10.513,"pebble_writepack_100_ms":6.957,"pebble_writepack_1m_bytes_op":1990090236,"pebble_writepack_1m_allocs_op":3021968,"pebble_readpaginated_100k_ms":131.857,"pebble_readpaginated_1k_ms":3.971,"pebble_writegrant_solo_ns_op":16036,"codec_direct_ns_op":448.5,"codec_reflect_ns_op":1393,"sqlite_writepack_1k_ms":29.372},"status":"discard","description":"Re-attempt FlushSplitBytes 2\\u219216 MiB at the new (faster) baseline (was #21 at 2626ms baseline, then flat). Now at 1539ms baseline: also flat (-0.04% primary). WriteEnvelope tar+zstd over the Pebble checkpoint dir isn't bottlenecked by per-SST overhead at this scale even when wallclock is much lower.","timestamp":1779695492348,"segment":0,"confidence":3.7000541600422534,"asi":{"hypothesis":"with wallclock now -64% lower, the relative cost of WriteEnvelope tar over ~265 small SST files might be bigger and FlushSplitBytes 16 MiB (≈50 SSTs) would help","result":"still flat. WriteEnvelope isn't a meaningful fraction at this scale.","rollback_reason":"below noise floor across runs","next_action_hint":"Real remaining bottlenecks are: GC scan (~440ms CPU from 3M proto allocs), our parallel sort+merge for idx (~600ms CPU), Pebble flush (background but blocks Close). The 3M allocs come from V2GrantToV3 in the adapter — attacking that requires either pooling (risky with proto-generated structs) or a new direct-V2-write engine API (significant refactor)."}}
{"run":32,"commit":"3d660b9","metric":1540.817,"metrics":{"pebble_writepack_100k_ms":166.981,"pebble_writepack_10k_ms":31.978,"pebble_writepack_1k_ms":10.419,"pebble_writepack_100_ms":7.154,"pebble_writepack_1m_bytes_op":2271800832,"pebble_writepack_1m_allocs_op":3021464,"pebble_readpaginated_100k_ms":130.457,"pebble_readpaginated_1k_ms":3.714,"pebble_writegrant_solo_ns_op":16387,"codec_direct_ns_op":404,"codec_reflect_ns_op":1316,"sqlite_writepack_1k_ms":29.106},"status":"discard","description":"Parallel 4-way k-way merge for idxBatch: pivot-partition the global keyspace via shard[0] quartiles, spawn 4 workers each merging its quarter into a local sub-batch, then Apply sub-batches back into idxBatch in order. Primary essentially flat (+0.1%). The serial merge wasn't the bottleneck I estimated \\u2014 it's already efficient (~100 ms not 340 ms). bytes_op +14% from the 4 sub-batches at peak; allocs flat.","timestamp":1779695922534,"segment":0,"confidence":3.7589292723669563,"asi":{"hypothesis":"serial k-way merge in idxBatch goroutine is the longest single-threaded stretch (≈340 ms estimated); parallelizing would cut critical path ≈16%","result":"flat. Cost estimate was wrong by 3–4x.","rollback_reason":"no signal + bytes_op +14% memory pressure regression","estimate_correction":"I assumed ~170 ns per merge iteration (find-min among 4 + Set). Reality is closer to ~50 ns: find-min over 4 sorted streams with branch-predictable arena.key() lookups is extremely cache-friendly, and idxBatch.Set with pre-sized batch buffer is essentially a memcpy. Serial merge is more like 100–120 ms wallclock, not 340 ms.","where_time_actually_goes":"Probably more in (a) Pebble Commit pipeline serialization, (b) flush wait in EndFreshSync, (c) c1z pack — all single-threaded stretches we already explored. The remaining wallclock at 1539 ms is hard to attack without architectural changes.","next_action_hint":"Skip further parallelism within PutGrants. Try (a) reducing the actual data going to disk (compression preset tuning across L levels), (b) overlap EndFreshSync.Flush with the prior goroutine work via AsyncFlush, or (c) accept the current plateau. Don't keep adding speculative parallelism without profile evidence."}}
{"run":33,"commit":"8525c14","metric":1455.267,"metrics":{"pebble_writepack_100k_ms":162.265,"pebble_writepack_10k_ms":26.291,"pebble_writepack_1k_ms":9.789,"pebble_writepack_100_ms":7.098,"pebble_writepack_1m_bytes_op":1991636048,"pebble_writepack_1m_allocs_op":3021559,"pebble_readpaginated_100k_ms":132.104,"pebble_readpaginated_1k_ms":3.681,"pebble_writegrant_solo_ns_op":16916,"codec_direct_ns_op":449,"codec_reflect_ns_op":1451,"sqlite_writepack_1k_ms":28.613},"status":"keep","description":"Move priBatch.Commit and idxBatch.Commit INSIDE their respective parallel goroutines (fresh-sync skipGet path). writepack_1m 1539\\u21921455 ms (-5.4%). 10k workload -13.1%. Mechanism is richer than the simple commit-overlap estimate: priBatch finishes building first (\\u2248200 ms before idxBatch's sort+merge completes), so its Commit runs while idxBatch is still working. This (a) hides the Pebble flushable-batch promotion CPU behind ongoing work, and (b) lets Pebble's background flusher start draining priBatch's L0 SSTs early, reducing the wait in EndFreshSync.Flush(). Pebble.Batch is not safe for concurrent use of the SAME batch, but two different batches committed from two goroutines serialize correctly through Pebble's internal writeMu \\u2014 documented in Pebble v2 source.","timestamp":1779696339712,"segment":0,"confidence":3.935496446914603,"asi":{"hypothesis":"priBatch finishes building well before idxBatch's sort+merge completes. Moving its Commit into the priBatch goroutine overlaps the commit work with idxBatch's ongoing work — estimated ~30 ms save.","result":"primary -5.4% (1539→1455 ms), ~84 ms save — nearly 3× the estimate. 10k -13.1%, 1k -6.6%.","mechanism_insight":"Two compounding effects: (1) Pebble's flushable-batch promotion at Commit time has measurable CPU cost (sort, batch repr scan, queue update) that runs serially in our previous code; running it in parallel hides it. (2) After priBatch commits, Pebble's flusher goroutine picks it up immediately and starts writing L0 SSTs in background while idxBatch is still sorting. By the time EndFreshSync.Flush() is called, priBatch's flush is partly done, so the synchronous wait is shorter.","cumulative_progress":"4291.9 ms → 1455.3 ms = -66.1% from RFC baseline. Eleven compounding wins.","10k_outsized_gain":"writepack_10k -13.1% (30.3→26.3 ms) is larger than the primary's -5.4%. At 10k, the commits and Pebble flush represent a relatively larger fraction of total wallclock, so overlapping them saves a bigger %.","thread_safety_check":"Pebble.Batch documentation: 'a batch is not safe for concurrent use' refers to a single batch. Two different batches committed by two goroutines is safe — internal writeMu serializes them. Verified by passing engine + adapter + compactor + equivalence tests.","no_regressions":"bytes_op flat, allocs flat, SQLite sentinel -2.7% (flat noise). writegrant_solo +5.6% within noise.","next_action_hint":"The remaining wallclock is ~1.4 s. PutGrants is now ≈500-600 ms; the rest (~800 ms) is in EndFreshSync + Close (CheckpointTo + WriteEnvelope). Attacking the Close path more aggressively might be the next avenue — parallel envelope write was tested twice with mixed results, but with everything else faster the relative cost is bigger now."}}
{"run":34,"commit":"9b8fc47","metric":1420.175,"metrics":{"pebble_writepack_100k_ms":158.194,"pebble_writepack_10k_ms":28.038,"pebble_writepack_1k_ms":10.041,"pebble_writepack_100_ms":7.086,"pebble_writepack_1m_bytes_op":1991744320,"pebble_writepack_1m_allocs_op":3022054,"pebble_readpaginated_100k_ms":133.112,"pebble_readpaginated_1k_ms":3.465,"pebble_writegrant_solo_ns_op":16520,"codec_direct_ns_op":477,"codec_reflect_ns_op":1358,"sqlite_writepack_1k_ms":28.003},"status":"keep","description":"After both parallel commits, call e.db.AsyncFlush() to force Pebble's flusher to schedule immediately rather than wait for its next polling cycle. writepack_1m 1455\\u21921420 ms (-2.4%, borderline above ~2% noise floor); writepack_100k -2.4% confirming directional signal (both improvements match); writepack_10k +6.5% (within its 10-15% noise floor at 2-iter -benchtime). Mechanism: AsyncFlush rotates the (already-empty) memtable and notifies the flusher goroutine, giving it a head start before EndFreshSync.Flush() arrives to block. Only runs on the large-batch skipGet path. Borderline but mechanism is sound and change is 5 lines.","timestamp":1779696966478,"segment":0,"confidence":3.822824779637529,"asi":{"hypothesis":"Pebble's flusher goroutine has a small scheduling latency between flushable-batch enqueue and actually starting to process; explicit AsyncFlush() forces immediate wake-up.","result":"primary -2.4%, just above the ~2% noise floor. 100k -2.4% directionally confirms. 10k +6.5% but within 10-15% noise for that scale.","borderline_keep_rationale":"Two independent signals at 1M and 100k point the same direction with the same magnitude (-2.4%). Pure noise would more often have them point opposite ways. The mechanism is sound (rotating memtable wakes flusher). Code change is tiny (5 lines, gated on the same parallelMinRecords threshold). Worst case if it's actually noise, we'd see in subsequent benches — easy to revert.","cumulative_progress":"4291.9 ms → 1420.2 ms = -66.9%. Twelve compounding wins. Each successive win is harder to extract.","next_action_hint":"Most clean ideas exhausted. Remaining angles are either: (a) too risky (proto pool, codec codegen), (b) within noise (block size, FlushSplitBytes, compression presets), or (c) require measurement infra (block profile to find exact wait points). May be approaching the practical ceiling at the bench's measurement precision.","noise_floor_observation":"At 1455 ms baseline, primary varies ±30-40 ms (2-3%) run-to-run. This experiment's -35 ms is just barely above. Future iterations need either bigger gains or more measurement runs to discriminate from noise.","mechanism_low_risk":"AsyncFlush doesn't change durability semantics (EndFreshSync still does Flush+Sync); doesn't change correctness; doesn't add allocations. Pure scheduling hint."}}
{"run":35,"commit":"9b8fc47","metric":1412.159,"metrics":{"pebble_writepack_100k_ms":158.475,"pebble_writepack_10k_ms":27.616,"pebble_writepack_1k_ms":9.985,"pebble_writepack_100_ms":7.213,"pebble_writepack_1m_bytes_op":1992633988,"pebble_writepack_1m_allocs_op":3021501,"pebble_readpaginated_100k_ms":132.511,"pebble_readpaginated_1k_ms":3.647,"pebble_writegrant_solo_ns_op":17524,"codec_direct_ns_op":348.5,"codec_reflect_ns_op":1380,"sqlite_writepack_1k_ms":27.791},"status":"discard","description":"Add zstd.WithEncoderConcurrency(0) to WriteEnvelope's writeZstdTar (use GOMAXPROCS workers). Previously tested at 3575ms baseline (#9) bundled with SpeedFastest change \\u2014 flat then. Now tested at 1420ms baseline with only the concurrency change. Still flat: primary -0.6% within ~2% noise; all secondaries flat. zstd's 80ms CPU was either already overlapping with other parallel work or its block-parallel mode doesn't engage well for tar streams of small ~2MB Pebble SST files.","timestamp":1779697318881,"segment":0,"confidence":3.628919118715603,"asi":{"hypothesis":"At 1420ms baseline, zstd's 80ms CPU is 5.6% of wallclock; parallel block encoding via WithEncoderConcurrency(0) might save ~50ms.","result":"Flat (-0.6% primary, all secondaries flat). The expected save did not materialise.","rollback_reason":"Within noise floor.","mechanism_failure_hypothesis":"klauspost zstd's parallel mode buffers input chunks and dispatches to workers, but the tar.Writer feeds zstd via tar.WriteHeader then io.Copy(tw, sst_file) for each ~2MB SST file. The encoder may not accumulate enough input to dispatch workers efficiently — each 2MB chunk fits within a single block window. Effectively single-threaded for our access pattern. To actually parallelise, we'd need either (a) buffer all checkpoint dir bytes into one big slab then compress (memory-expensive), or (b) replace tar+zstd with a parallel-friendly archive format.","next_action_hint":"WriteEnvelope is hard to attack without an architectural change. Remaining angles: (1) move the EndFreshSync.Flush wait to overlap with subsequent work (unclear what's parallelizable post-EndSync), (2) precompute the c1z manifest ahead of time (saves tiny bytes), (3) accept the plateau at -67%."}}
{"run":36,"commit":"9b8fc47","metric":1419.563,"metrics":{"pebble_writepack_100k_ms":160.523,"pebble_writepack_10k_ms":26.444,"pebble_writepack_1k_ms":9.806,"pebble_writepack_100_ms":6.927,"pebble_writepack_1m_bytes_op":1993005752,"pebble_writepack_1m_allocs_op":3021501,"pebble_readpaginated_100k_ms":132.958,"pebble_readpaginated_1k_ms":3.661,"pebble_writegrant_solo_ns_op":16576,"codec_direct_ns_op":435.5,"codec_reflect_ns_op":1370,"sqlite_writepack_1k_ms":27.842},"status":"discard","description":"Parallelize EndFreshSync's Flush and LogData(Sync) by using AsyncFlush and running LogData in parallel. Primary flat (-0.04%). Mixed small signals at smaller scales (10k -5.7%, 1k -2.4%, 100k +1.5%) all within noise. The two operations don't actually overlap as theorized \\u2014 either Pebble's internal commit pipeline serializes them through writeMu / commit.mu, or both ultimately compete for the same disk-write bandwidth which makes parallelism a wash.","timestamp":1779697721646,"segment":0,"confidence":3.442725382383247,"asi":{"hypothesis":"EndFreshSync.Flush waits on Pebble's flusher goroutine (L0 writes) while LogData(Sync) waits on WAL fsync. They touch independent state and should overlap if called concurrently.","result":"primary flat. Save did not materialise.","rollback_reason":"no signal at primary metric.","mechanism_failure_hypothesis":"Two plausible explanations: (a) Pebble's commit pipeline acquires commit.mu and the WAL writer's lock; LogData blocks on commit.mu while AsyncFlush already holds it (or just released), so they end up serial anyway. (b) Even if logically parallel, both are dirty-page-flushing on the same disk. Disk bandwidth is the shared bottleneck, so running them concurrently doesn't reduce wallclock — only their CPU work would, which is small (<10 ms each).","next_action_hint":"EndFreshSync optimization seems exhausted. The remaining 1420 ms wallclock is dominated by (1) parallel-build phase (≈450 ms), (2) Pebble flush wait (≈50 ms), (3) Checkpoint (≈100 ms), (4) WriteEnvelope tar+zstd (≈200 ms), (5) fsync + Close (≈50 ms). Categories (3) and (4) are file I/O bound and hard to attack without architectural changes. We may genuinely be at the practical floor for this bench."}}
