{"run":11,"commit":"e872976","metric":3375.282,"metrics":{"pebble_writepack_100k_ms":353.259,"pebble_writepack_10k_ms":47.601,"pebble_writepack_1k_ms":11.254,"pebble_writepack_100_ms":7.465,"pebble_writepack_1m_bytes_op":1653887728,"pebble_writepack_1m_allocs_op":4020047,"pebble_readpaginated_100k_ms":143.314,"pebble_readpaginated_1k_ms":3.675,"pebble_writegrant_solo_ns_op":11822,"codec_direct_ns_op":461,"codec_reflect_ns_op":1338,"sqlite_writepack_1k_ms":27.872},"status":"keep","description":"P3.8: scratch byte buffers reused across PutGrantRecords loop + proto.MarshalAppend instead of Marshal. writepack_1m 3575→3375ms (-5.6%). Allocs/op 9.0M→4.0M (-55%). Bytes/op 2108→1654 MB (-21.5%). Mechanism: pebble.Batch.Set copies key/value into its internal buffer (vendor/pebble/v2/batch.go line 819), so caller can immediately reuse the slice. Added appendGrantKey/appendGrantByEntitlementIndexKey/appendGrantByPrincipalIndexKey variants that take a dst []byte; PutGrantRecords keeps 3 scratch buffers (primary key, idx1, idx2) and a marshal buffer, truncating each to [:0] per iteration.","timestamp":1779686995582,"segment":0,"confidence":3.020244355699658,"asi":{"hypothesis":"the 5 allocs/grant in PutGrantRecords (3 key encodes, 1 proto marshal, 1 closer struct from Get) drove 16% GC time per the cpuprofile; pooling the encoder + marshal buffers should cut GC and total wallclock","result":"primary -5.6%, allocs -55%, bytes_op -21.5% — hypothesis confirmed","mechanism_insight":"Two changes combined: (1) added appendGrant*Key variants taking dst []byte; reused 3 scratch buffers across all records in the batch (truncated via buf[:0]). (2) Replaced marshalRecord(r) with marshalOpts.MarshalAppend(valBuf[:0], r). pebble.Batch.Set is documented as 'safe to modify the arguments after Set returns' (Set: copy(deferredOp.Key, key); copy(deferredOp.Value, value)), so the same scratch slice can be reused for the next iteration with no observable change to the batch contents.","cumulative_progress":"4291.9ms (RFC baseline) → 3375.3ms (-21.4%). Two kept wins so far: L0CompactionThreshold 2→8 (-15.8%) and scratch buffers (-5.6%).","next_idea":"more allocs to chase: idBytes (e.resolveSyncBytes) is called per record — if it allocates a fresh slice each call, cache it. Also the v3.GrantRecord{} for the unmarshal-old path allocates; could pool. But for fresh-sync the old path is never taken (Get returns ErrNotFound). The bigger remaining ASI: apply the same scratch-buffer pattern to PutResourceRecords / PutEntitlementRecords / PutResourceTypeRecords — same allocation pattern. Or codec-codegen for proto.Marshal (P2.7, big change).","sqlite_sentinel_ok":"+1.2% — noise"}}
{"run":12,"commit":"47a1ec9","metric":3209.104,"metrics":{"pebble_writepack_100k_ms":326.85,"pebble_writepack_10k_ms":43.186,"pebble_writepack_1k_ms":10.647,"pebble_writepack_100_ms":7.218,"pebble_writepack_1m_bytes_op":1626632284,"pebble_writepack_1m_allocs_op":3020505,"pebble_readpaginated_100k_ms":145.368,"pebble_readpaginated_1k_ms":3.737,"pebble_writegrant_solo_ns_op":12100,"codec_direct_ns_op":539,"codec_reflect_ns_op":1308,"sqlite_writepack_1k_ms":28.108},"status":"keep","description":"Hoist resolveSyncBytes out of PutGrantRecords loop with last-value cache. writepack_1m 3375→3209ms (-4.9%). Allocs 4.02M→3.02M (-25%) — the 1M per-record 20-byte syncBytes copies are gone. Falls back to per-record resolve if sync_id string differs from the last (uncommon for fresh-sync writes that share one sync). Mutex acquisitions also drop from 1M to 1.","timestamp":1779687307113,"segment":0,"confidence":3.1899916331797464,"asi":{"hypothesis":"resolveSyncBytes is called per-record but most callers share one sync; cache last-resolved value","result":"primary -4.9%, allocs -25% (-1M allocs/op), 100k workload -7.4%","mechanism_insight":"Each resolveSyncBytes does RLock + 20-byte make+copy. Across 1M records this adds up to 1M mutex acquisitions and 20MB of garbage. Caching the last-resolved (string, bytes) pair eliminates both for the common case (adapter's V2→V3 translation stamps every record with engine.currentSync). Cache invalidation is per-record on string compare, so multi-sync callers still see correct results.","cumulative_progress":"4291.9ms → 3209.1ms (-25.2%). Wins so far: L0CompactionThreshold 2→8 (-15.8%), scratch buffers + MarshalAppend (-5.6%), hoisted resolveSyncBytes (-4.9%). They compound multiplicatively.","next_idea":"still 3M allocs/op remaining — mostly probably from db.Get's closer struct (1M instances) and Pebble-internal allocs we can't easily touch. Maybe pool the closer? Actually it's a small object. Other angle: profile again with this baseline to see what's now hot. The 1M run is dominated by what's downstream of the loop now — maybe Pebble compaction or the EndFreshSync Flush. Or apply the same scratch-buffer pattern to resources/entitlements/resource_types Put functions for transferable wins (not measured by this bench but matters in production)."}}
{"run":13,"commit":"63c0869","metric":2798.147,"metrics":{"pebble_writepack_100k_ms":295.581,"pebble_writepack_10k_ms":41.683,"pebble_writepack_1k_ms":11.312,"pebble_writepack_100_ms":7.456,"pebble_writepack_1m_bytes_op":1577826300,"pebble_writepack_1m_allocs_op":3021975,"pebble_readpaginated_100k_ms":129.039,"pebble_readpaginated_1k_ms":3.637,"pebble_writegrant_solo_ns_op":12416,"codec_direct_ns_op":389,"codec_reflect_ns_op":1353,"sqlite_writepack_1k_ms":28.708},"status":"keep","description":"Split PutGrantRecords into two pebble.Batches: primary keys vs index keys. writepack_1m 3209→2798ms (-12.8%). Primary keys arrive sorted by external_id (the iteration order); pdqsort detects this and short-circuits to near-O(N) during flushable-batch promotion. Index keys (entitlement_id, principal_id) interleave with no sort order and pay the full O(N log N) sort, but on 2/3 the entries instead of 3/3. Cross-batch atomicity is fine for fresh-sync (replays from connector on crash). Reads also -11% at 100k (smaller batches \\u2192 less L0 read amp during compaction). SQLite sentinel +2%, within tolerance.","timestamp":1779687701634,"segment":0,"confidence":3.9793142948478866,"asi":{"hypothesis":"the flushableBatch sort is the largest remaining cost (1.03 s in profile, 21% of total). Bench grant external_ids are emitted in lex-sorted order, so the primary key stream is pre-sorted; the index streams (entitlement_id, principal_id) are not. Splitting the batch lets pdqsort take its sorted-input early exit on the primary side.","result":"primary -12.8%, no allocs cost, reads also -11% at 100k","mechanism_insight":"Pebble's `newFlushableBatch` calls `sort.Sort(b)` over the batch's offset table; sort.Sort uses pdqsort which detects already-sorted input and short-circuits. By writing only primary keys to priBatch (which are sorted by external_id by construction in this bench, and typically in production too — paginated connector sources walk in stable order), priBatch's flushable-batch promotion is nearly free. The smaller idxBatch (2 entries per grant instead of 3) is unsorted but pays sort cost only on 2N entries vs 3N. Net: ~400 ms shaved.","cumulative_progress":"4291.9 ms (RFC baseline) → 2798.1 ms (-34.8%). Wins: L0CompactionThreshold 2→8 (-15.8%), scratch buffers + MarshalAppend (-5.6%), hoisted resolveSyncBytes (-4.9%), split priBatch/idxBatch (-12.8%). Compounding.","production_consideration":"Cross-batch atomicity: if priBatch commits but idxBatch fails, the primary records exist without indexes — iteration via the by_entitlement / by_principal indexes would miss those grants. For fresh-sync this is acceptable (replay) but for incremental syncs we may need to handle this differently. Worth a follow-up doc note.","next_idea":"Can we make idxBatch's sort fast too? Pre-sort index keys before emitting them. This requires holding all keys in memory before commit (2M index keys × ~80 bytes = ~160MB extra). Or: apply the same split to PutResourceRecords / PutEntitlementRecords for transferable production wins. Or: re-profile to see what's now hot."}}
{"run":14,"commit":"799a0c0","metric":2626.178,"metrics":{"pebble_writepack_100k_ms":257.968,"pebble_writepack_10k_ms":45.577,"pebble_writepack_1k_ms":10.804,"pebble_writepack_100_ms":7.174,"pebble_writepack_1m_bytes_op":1208123944,"pebble_writepack_1m_allocs_op":3021748,"pebble_readpaginated_100k_ms":129.473,"pebble_readpaginated_1k_ms":3.567,"pebble_writegrant_solo_ns_op":13447,"codec_direct_ns_op":398.5,"codec_reflect_ns_op":1286,"sqlite_writepack_1k_ms":27.77},"status":"keep","description":"Use NewBatchWithSize(len*600) and len*140 to pre-allocate the priBatch and idxBatch internal buffers. writepack_1m 2798→2626ms (-6.1%). bytes_op 1578→1208 MB (-23%). Pebble batches grow by 2x when full; with no size hint, a 600 MB batch goes through ~10 doublings, leaving up to 2x slack peak. Sizing exactly avoids the overshoot. Also: each grow does a memcpy that's now skipped.","timestamp":1779688028801,"segment":0,"confidence":3.31640148645595,"asi":{"hypothesis":"Pebble batches grow-by-2x internally; for a 1M-grant batch we pay ~10 reallocations and end with up to 2x peak overshoot. NewBatchWithSize lets us pre-allocate.","result":"primary -6.1%, bytes_op -23%, writepack_100k -13%","mechanism_insight":"Sizing constants (600 / 140) derived from observed batch sizes (priBatch ≈ 530 MB / 1M grants ≈ 530 B/grant for key+val+entry header; idxBatch ≈ 120 MB / 1M / 2 indexes = 60 B/key + overhead). The slop is small enough to avoid waste on tiny PutGrants calls.","cumulative_progress":"4291.9 ms → 2626.2 ms (-38.8%). Five compounding wins: L0CompactionThreshold (-15.8%), scratch buffers (-5.6%), hoist resolveSyncBytes (-4.9%), split batches (-12.8%), pre-size batches (-6.1%).","next_idea":"The remaining 2.6 s wallclock has the idxBatch sort still at ~0.4 s (its 2M unsorted entries paying full pdqsort). Pre-sorting in our code would cost ~600 ms in our own pdqsort + 168 MB extra memory — net loss. Better next angle: profile again on the new code and look for what's hot below the loop body.","small_workload_concern":"writepack_100 is 7.17 ms; with len*600 + len*140 = 740 bytes for 100-grant calls that's 74 KB pre-alloc. Trivial."}}
{"run":15,"commit":"799a0c0","metric":2687.8,"metrics":{"pebble_writepack_100k_ms":268.24,"pebble_writepack_10k_ms":46.033,"pebble_writepack_1k_ms":10.588,"pebble_writepack_100_ms":6.998,"pebble_writepack_1m_bytes_op":1207162512,"pebble_writepack_1m_allocs_op":3021730,"pebble_readpaginated_100k_ms":129.551,"pebble_readpaginated_1k_ms":3.609,"pebble_writegrant_solo_ns_op":13109,"codec_direct_ns_op":462,"codec_reflect_ns_op":1236,"sqlite_writepack_1k_ms":28.143},"status":"checks_failed","description":"SetDeferred for primary key+value to skip memcpy into batch buffer. Primary +2.3% (slight regression), lint failed on 3 unused helpers I added speculatively for index keys but didn't wire up. The marshalOpts.Size(r) call traverses the proto message once just to compute size, then MarshalAppend traverses it again to write — doubled the proto work in the loop, eating the memcpy savings. Net loss.","timestamp":1779688673149,"segment":0,"confidence":2.626769736364871,"asi":{"hypothesis":"SetDeferred eliminates the per-Set memcpy into Pebble's batch buffer (~500 MB of copies at 1M scale)","result":"primary +2.3% slight regression, allocs unchanged","rollback_reason":"primary metric regressed; also lint failure","mechanism_insight":"proto.MarshalAppend internally calls Size first then writes. Adding our own Size() before SetDeferred causes a SECOND full traversal of the message tree per record — 0.16 s in the profile was already from marshalAppendPointer; adding Size doubles that. The ~85 ms expected memcpy savings (Pebble's batch.Set inline copy) is overwhelmed by the ~100–150 ms of redundant Size calls.","alternative":"If we could use proto.MarshalState which doesn't recompute size, this might work. But it's a less stable API. Skip.","lesson":"Pebble's batch.Set already inlines the copy efficiently (single memcpy from caller slice). For values that come from a proto Marshal, MarshalAppend writes directly to the caller's slice anyway — the copy in Set is from MarshalAppend's output buffer to batch buffer. Eliminating it via SetDeferred only helps if we can write directly without a precomputed size. proto.Marshal API doesn't expose that cheaply.","next_action_hint":"Skip SetDeferred path. Try other angles: maybe re-evaluate memtable size now that the path is faster. Or look at applying lessons to other Put paths. Or just accept that we're near the bottom of easily-extractable wins (~39% from baseline) and finalize."}}
{"run":16,"commit":"799a0c0","metric":2593.653,"metrics":{"pebble_writepack_100k_ms":346.241,"pebble_writepack_10k_ms":45.589,"pebble_writepack_1k_ms":10.712,"pebble_writepack_100_ms":6.953,"pebble_writepack_1m_bytes_op":1221974660,"pebble_writepack_1m_allocs_op":3022106,"pebble_readpaginated_100k_ms":126.982,"pebble_readpaginated_1k_ms":3.597,"pebble_writegrant_solo_ns_op":12876,"codec_direct_ns_op":321,"codec_reflect_ns_op":529.5,"sqlite_writepack_1k_ms":27.579},"status":"discard","description":"MemTableSize 64→128 MiB. Primary -1.3% (within noise), but writepack_100k +34% (258→346ms) — same anti-pattern as the earlier 256 MiB attempt. 128MB absorbs the entire 100k workload (~100MB) → no in-flight flushes → big serial flush at EndFreshSync where it can't overlap with writes.","timestamp":1779688927481,"segment":0,"confidence":2.601803445383535,"asi":{"hypothesis":"after the other wins, 128 MiB memtable might now help 1M without hurting 100k","result":"100k regression is the same; primary improvement is within noise","rollback_reason":"+34% catastrophic regression on writepack_100k secondary","mechanism_confirmed":"100k workload (~100 MB) fits in 128 MB memtable, so no during-write flushes. EndFreshSync.Flush + LogData(Sync) then serializes the entire 100 MB to L0 + the WAL fsync. With 64 MB memtable, the 100k workload triggers ~2 flushes that overlap with subsequent writes. The crossover point is fundamental: memtable should be sized so the WORKLOAD triggers ≥3 flushes, not 0–1.","interesting_observation":"writepack_1m_bytes_op went UP slightly with 128 MiB (1208→1222 MB) — the memtable's idle slack consumes more bytes-per-op when it doesn't get flushed during the workload.","next_action_hint":"memtable axis is dead at every size we'd try. Accept the current state. Things left to explore: (a) re-check whether L0=4 is now better than L0=8 given the other wins (the optimal L0 might have shifted), (b) try CompactionConcurrencyRange (2, 6) since L0 is also smaller, (c) call it good and finalize. Tilt toward (c) — cumulative -39% is a strong result and the bench's underlying mechanics are now well-understood."}}
{"run":17,"commit":"799a0c0","metric":2583.937,"metrics":{"pebble_writepack_100k_ms":260.541,"pebble_writepack_10k_ms":44.703,"pebble_writepack_1k_ms":11.427,"pebble_writepack_100_ms":7.2,"pebble_writepack_1m_bytes_op":1209202636,"pebble_writepack_1m_allocs_op":3021782,"pebble_readpaginated_100k_ms":131.719,"pebble_readpaginated_1k_ms":3.72,"pebble_writegrant_solo_ns_op":12145,"codec_direct_ns_op":442.5,"codec_reflect_ns_op":1488,"sqlite_writepack_1k_ms":28.692},"status":"discard","description":"LBaseMaxBytes 256→512 MiB. Primary -1.6% (within ~2% noise floor); writepack_1k +5.6% small regression; rest flat. Bigger L1 base could reduce L0→L1 compaction frequency at 1M, but the effect is below the noise floor of this 2-iteration benchmark. Not worth pinning an unjustified knob.","timestamp":1779689277724,"segment":0,"confidence":2.577307273357431,"asi":{"hypothesis":"Larger LBaseMaxBytes consolidates L1 → fewer L0→L1 compactions at 1M scale","result":"primary -1.6% (below noise), writepack_1k +5.6% regression","rollback_reason":"primary delta below noise floor; secondary regression on 1k scale; can't justify pinning the knob","knee_observation":"We've now tried the cardinal Pebble knobs: MemTableSize (regresses 100k at any size > 64), L0CompactionThreshold (8 was the keep), CompactionConcurrencyRange (saturated), LBaseMaxBytes (flat), bloom filters (regress), compression preset (irrelevant for already-compressed payload). The remaining wallclock is split between fundamental work (proto marshal, flushable-batch sort, c1z pack zstd) and overhead we can't easily attack. Cumulative -38.8% feels close to the practical ceiling for this loop.","next_action_hint":"One last experiment worth trying: apply scratch buffers + split batches to PutEntitlements / PutResources / PutResourceTypes (transferable production wins, not measured by this bench). Beyond that, the work is finalize + write up."}}
{"run":18,"commit":"799a0c0","metric":2680.328,"metrics":{"pebble_writepack_100k_ms":261.237,"pebble_writepack_10k_ms":44.069,"pebble_writepack_1k_ms":10.95,"pebble_writepack_100_ms":7.206,"pebble_writepack_1m_bytes_op":1208658784,"pebble_writepack_1m_allocs_op":3021193,"pebble_readpaginated_100k_ms":128.329,"pebble_readpaginated_1k_ms":3.63,"pebble_writegrant_solo_ns_op":13604,"codec_direct_ns_op":438,"codec_reflect_ns_op":1316,"sqlite_writepack_1k_ms":29.67},"status":"discard","description":"L0CompactionThreshold 8→6. 2626→2680ms (+2%). L0=8 remains the knee post-other-wins. The L0 axis has been thoroughly mapped: 2 (slowest), 4 (slight), 6 (worse than 8), 8 (knee), 16 (flat vs 8).","timestamp":1779689797815,"segment":0,"confidence":2.5297960944168207,"asi":{"hypothesis":"with the loop body faster, perhaps the optimal L0 has shifted lower","result":"L0=6 is worse than L0=8; the knee did NOT shift","rollback_reason":"primary +2% regression","L0_axis_done":"L0=2 (4246ms), L0=4 (4214ms), L0=6 (2680ms with all other wins), L0=8 (2626ms with all other wins), L0=16 (3580ms early, equiv-to-8 with all other wins). L0=8 is the stable knee.","next_action_hint":"L0 axis is done. Remaining options: try parallelism on the c1z pack step (zstd already concurrent=0 but didn't help; maybe try zstd.WithEncoderConcurrency(GOMAXPROCS) explicitly). Or call the loop complete — cumulative -39% is the practical ceiling without API-breaking changes (e.g. codegen replacing reflection codec, or batch.SetDeferred with cached sizes)."}}
