{"type":"config","name":"Pebble engine perf — minimize WritePack 1M grants","metricName":"pebble_writepack_1m_ms","metricUnit":"ms","bestDirection":"lower"}
{"run":1,"commit":"fef0cba","metric":4291.902,"metrics":{"pebble_writepack_100k_ms":400.225,"pebble_writepack_10k_ms":52.293,"pebble_writepack_1k_ms":12.623,"pebble_writepack_100_ms":8.48,"pebble_writepack_1m_bytes_op":2120391296,"pebble_writepack_1m_allocs_op":9028395,"pebble_readpaginated_100k_ms":145.078,"pebble_readpaginated_1k_ms":3.802,"pebble_writegrant_solo_ns_op":13470,"codec_direct_ns_op":469,"codec_reflect_ns_op":530.5,"sqlite_writepack_1k_ms":28.803},"status":"checks_failed","description":"Baseline run on scaffold commit. Bench succeeded (writepack_1m=4291.9ms matches RFC baseline of 4240ms within noise). Checks failed on a PRE-EXISTING lint issue in pkg/dotc1z/engine/equivalence/equivalence_test.go:56 (gosec G602 false-positive `entPool[i%len(entPool)]`). Local golangci-lint v2.9.0 flags it; CI v2.12.2 likely does not — but our gate uses local. Need a nolint annotation before any perf experiment can register as keep.","timestamp":1779683958255,"segment":0,"confidence":null,"asi":{"hypothesis":"establish baseline before any optimization","baseline_pebble_writepack_1m_ms":4291.9,"baseline_matches_rfc":"4240ms in RFC, 4291.9ms measured — within ~1% noise","host":"16-core (GOMAXPROCS=16) arm64 linux","lint_blocker":"pkg/dotc1z/engine/equivalence/equivalence_test.go:56 gosec G602 — i%len(entPool) flagged as OOB; false positive when len>0","lint_blocker_version_skew":"local golangci-lint v2.9.0 vs CI v2.12.2; fixing via //nolint:gosec is forward-compatible","next_action_hint":"make a non-experimental fixup commit adding //nolint:gosec at equivalence_test.go:56, then re-run baseline. After that, start with P1.1 (memtable 64→256 MiB) which has the cleanest hypothesis-to-mechanism mapping for 1M writes.","rollback_reason":"checks_failed on pre-existing lint, not on our scaffolding","bench_pipeline_validated":true}}
{"run":2,"commit":"f5b94e1","metric":4245.856,"metrics":{"pebble_writepack_100k_ms":388.917,"pebble_writepack_10k_ms":48.469,"pebble_writepack_1k_ms":10.812,"pebble_writepack_100_ms":7.163,"pebble_writepack_1m_bytes_op":2120440040,"pebble_writepack_1m_allocs_op":9028378,"pebble_readpaginated_100k_ms":147.984,"pebble_readpaginated_1k_ms":3.454,"pebble_writegrant_solo_ns_op":11582,"codec_direct_ns_op":419.5,"codec_reflect_ns_op":1490,"sqlite_writepack_1k_ms":27.536},"status":"keep","description":"Clean baseline after lint fixup. writepack_1m=4245.9ms; checks pass. This is the reference point for all subsequent perf experiments.","timestamp":1779684214979,"segment":0,"confidence":null,"asi":{"hypothesis":"establish a clean, gated baseline","baseline_clean_ms":4245.86,"noise_observation":"codec_reflect jumped 530.5→1490 ns/op between runs at -benchtime=2x; treat codec micros as advisory not authoritative","iteration_walltime_s":190,"checks_walltime_s":31.6,"next_idea":"P1.1 — MemTableSize 64→256 MiB in options.go. Hypothesis: a larger memtable absorbs more of the 1M-grant burst before triggering L0 flushes, reducing write stalls. Risk: memory pressure for multi-engine workloads (out of scope for bench)."}}
{"run":3,"commit":"f5b94e1","metric":4223.641,"metrics":{"pebble_writepack_100k_ms":514.426,"pebble_writepack_10k_ms":47.344,"pebble_writepack_1k_ms":11.386,"pebble_writepack_100_ms":7.206,"pebble_writepack_1m_bytes_op":2122580020,"pebble_writepack_1m_allocs_op":9035106,"pebble_readpaginated_100k_ms":116.1,"pebble_readpaginated_1k_ms":4.114,"pebble_writegrant_solo_ns_op":12806,"codec_direct_ns_op":486,"codec_reflect_ns_op":1525,"sqlite_writepack_1k_ms":27.884},"status":"discard","description":"P1.1: MemTableSize 64→256 MiB. Primary essentially flat (-0.5%, within noise) but writepack_100k regressed +32% (388.92→514.43ms). Large memtable absorbs the entire 100k workload then forces one big serial flush at finalize — hurts mid-scale throughput. Read side did benefit (-22% on 100k reads) because fewer SSTs to merge, but that's not what we're optimizing.","timestamp":1779684479784,"segment":0,"confidence":2.072743641683546,"asi":{"hypothesis":"larger memtable absorbs more 1M write burst before L0 flush","result":"primary within noise; 100k regressed +32%; reads improved -22%","rollback_reason":"catastrophic +32% regression on writepack_100k secondary; primary delta below noise floor","mechanism_insight":"MemTableSize trades flush amortization vs end-of-workload serial-flush cost. At 100k the entire dataset fits in 256 MiB memtable so it never flushes during writes — then EndFreshSync's Flush+LogData(Sync) has to push the whole thing serially. At 1M the memtable still fills multiple times so the effect washes out. The crossover suggests we want memtable sized so it flushes ~3-5x during the workload, not 0 times.","next_action_hint":"try P1.2 (L0CompactionThreshold) which is orthogonal to memtable sizing. Then revisit memtable at intermediate sizes like 128 MiB only if other wins land first. Also: the read win at 100k (-22%) is interesting and worth understanding — might suggest L0 file count is the read bottleneck.","secondary_regression_threshold_hit":"writepack_100k +32% > the implicit 5% sentinel","noise_floor_observed":"codec_reflect varies 530→1490→1525 ns/op across runs at -benchtime=2x; treat <2% primary deltas as noise"}}
{"run":4,"commit":"f5b94e1","metric":4213.641,"metrics":{"pebble_writepack_100k_ms":388.38,"pebble_writepack_10k_ms":50.049,"pebble_writepack_1k_ms":10.794,"pebble_writepack_100_ms":7.225,"pebble_writepack_1m_bytes_op":2116078324,"pebble_writepack_1m_allocs_op":9027637,"pebble_readpaginated_100k_ms":141.383,"pebble_readpaginated_1k_ms":3.565,"pebble_writegrant_solo_ns_op":11792,"codec_direct_ns_op":420,"codec_reflect_ns_op":1306,"sqlite_writepack_1k_ms":28.022},"status":"discard","description":"P1.2a: L0CompactionThreshold 2→4. Primary -0.8% (within noise floor ~2%), secondaries flat. No catastrophic regression but no signal either. Will try L0=8 next for a clearer read on the mechanism.","timestamp":1779684740719,"segment":0,"confidence":2.8586683222101548,"asi":{"hypothesis":"fewer L0 compactions during writes → less CPU contention with the write path","result":"primary within noise; no signal","rollback_reason":"delta below noise floor; nothing to keep","mechanism_insight":"L0CompactionThreshold may be a small-effect knob in our regime: with NoSync writes, the bottleneck is memtable→L0 flush throughput, not L0→L1 compaction contention. Total compaction work is roughly invariant; the threshold just shifts when it happens.","next_action_hint":"try L0CompactionThreshold=8 to see if there's any monotonic trend, then move on. If 8 also flat, this whole axis is dead; pivot to P1.3 (MaxConcurrentCompactions) or P1.5 (compression presets) which directly affect compaction CPU."}}
{"run":5,"commit":"20a8ecd","metric":3575.276,"metrics":{"pebble_writepack_100k_ms":364.502,"pebble_writepack_10k_ms":48.392,"pebble_writepack_1k_ms":10.943,"pebble_writepack_100_ms":7.224,"pebble_writepack_1m_bytes_op":2110861304,"pebble_writepack_1m_allocs_op":9020636,"pebble_readpaginated_100k_ms":145.051,"pebble_readpaginated_1k_ms":3.665,"pebble_writegrant_solo_ns_op":14066,"codec_direct_ns_op":447.5,"codec_reflect_ns_op":1288,"sqlite_writepack_1k_ms":28.587},"status":"keep","description":"P1.2b: L0CompactionThreshold 2→8. writepack_1m 4245.86→3575.28ms (-15.8%); writepack_100k -6.3%; reads & SQLite sentinel within tolerance. Solo write +21% in ns/op is engine startup noise on a non-hot path. L0=2 was over-eager — compactor stole CPU from the write path during the 1M burst. Letting ~8 L0 files accumulate frees that CPU.","timestamp":1779685003178,"segment":0,"confidence":32.25865406257013,"asi":{"hypothesis":"L0CompactionThreshold=2 over-compacts during write burst; raising to 8 frees CPU for the write path","result":"primary -15.8% (4245.9→3575.3ms), confirmed across scales; no catastrophic secondary regression","mechanism_insight":"With NoSync fresh-sync, writes append to memtable→WAL and the memtable spills to L0 every ~64 MiB. At L0=2, compactor wakes after every 2nd flush and competes with the writers for cores. L0=8 batches ~8 flushes (≈512 MiB of L0 data) before compaction, amortizing compactor wakeups. L0StopWritesThreshold=20 still bounds the worst case so we never stall. Confirms L0=4 result was \\\"on the trend\\\" (-0.8%); the curve is non-linear, with a knee between 4 and 8.","tradeoff":"Read amplification on L0 increases (more files to merge at read time), but our writepack_100k_reads stayed flat, suggesting L0=8 is still well under the L0 read-amp regime that hurts our workload.","secondary_solo_write_regression":"+21% on writegrant_solo_ns_op = 11.5→14.1µs; absolute number is engine open/close cost dominated by pebble.Open and goroutine spinup, not the write path. Negligible.","sqlite_sentinel":"+3.8%, under 5% threshold; SQLite path was not modified","next_idea":"L0=12 or L0=16 to find the knee top. Then P1.3 (MaxConcurrentCompactions). The big mechanism (compactor-vs-writer CPU contention) is now confirmed — several knobs likely sit on the same axis."}}
{"run":6,"commit":"20a8ecd","metric":3579.507,"metrics":{"pebble_writepack_100k_ms":362.531,"pebble_writepack_10k_ms":45.969,"pebble_writepack_1k_ms":10.643,"pebble_writepack_100_ms":7.01,"pebble_writepack_1m_bytes_op":2108776212,"pebble_writepack_1m_allocs_op":9021135,"pebble_readpaginated_100k_ms":147.385,"pebble_readpaginated_1k_ms":3.774,"pebble_writegrant_solo_ns_op":11630,"codec_direct_ns_op":396.5,"codec_reflect_ns_op":1434,"sqlite_writepack_1k_ms":28.769},"status":"discard","description":"P1.2c: L0CompactionThreshold 8→16. 3575.28→3579.51ms (+0.1%, flat). The knee was at 8; pushing higher saturates. Keep L0=8.","timestamp":1779685252055,"segment":0,"confidence":14.264620406863253,"asi":{"hypothesis":"find the knee top of the L0CompactionThreshold curve","result":"flat — 8 is already the knee","rollback_reason":"no improvement; primary delta within noise","knee_confirmed":"L0=2 → 4245.86ms; L0=4 → 4213.64ms; L0=8 → 3575.28ms; L0=16 → 3579.51ms. Discontinuity between 4 and 8 suggests something else flipped state — maybe at L0=8 the compactor stops competing with writers entirely until a single big drain at the end. Investigate via Pebble metrics if needed.","next_idea":"P1.3 — MaxConcurrentCompactions upper bound. Currently the lambda returns (2, min(8, GOMAXPROCS/4)) — on a 16-core box that's (2, 4). Try (2, 6) or (2, 8). With L0=8 already lessening compactor demand, more concurrency may not help much; but worth one shot."}}
{"run":7,"commit":"20a8ecd","metric":3577.337,"metrics":{"pebble_writepack_100k_ms":366.776,"pebble_writepack_10k_ms":51.017,"pebble_writepack_1k_ms":10.927,"pebble_writepack_100_ms":7.192,"pebble_writepack_1m_bytes_op":2107585848,"pebble_writepack_1m_allocs_op":9020541,"pebble_readpaginated_100k_ms":144.977,"pebble_readpaginated_1k_ms":3.828,"pebble_writegrant_solo_ns_op":14906,"codec_direct_ns_op":481.5,"codec_reflect_ns_op":1248,"sqlite_writepack_1k_ms":27.722},"status":"discard","description":"P1.3: CompactionConcurrencyRange upper GOMAXPROCS/4→GOMAXPROCS/2 (on 16-core host: 4→8). 3575.28→3577.34ms (+0.06%, flat). With L0=8 the compactor is no longer the bottleneck, so more lanes don't help.","timestamp":1779685511326,"segment":0,"confidence":9.156872516323537,"asi":{"hypothesis":"more compaction lanes accelerate the post-write drain","result":"flat — not the bottleneck anymore","rollback_reason":"no signal; current axis is saturated. Compaction concurrency only matters when compactor is on the critical path.","mechanism_insight":"L0CompactionThreshold and CompactionConcurrencyRange addressed the same underlying problem (compactor stealing CPU from writers). With L0=8 we've already removed that contention; adding compaction lanes simply means \\\"more concurrent things doing nothing useful during writes.\\\" Compaction now happens mostly post-burst when there's nothing to contend with.","next_idea":"shift axes. Try P1.4 (bloom filters) for read path — reads are now ≈16% of total time per the bench. Or P1.5 (mixed compression Snappy@L0 zstd@L6) which directly cuts compaction CPU. Compression knob feels like the highest-EV next attempt because it might also help reads (less data to decompress) without trading durability."}}
{"run":8,"commit":"20a8ecd","metric":3678.774,"metrics":{"pebble_writepack_100k_ms":376.23,"pebble_writepack_10k_ms":50.276,"pebble_writepack_1k_ms":10.96,"pebble_writepack_100_ms":6.879,"pebble_writepack_1m_bytes_op":2118823624,"pebble_writepack_1m_allocs_op":9021596,"pebble_readpaginated_100k_ms":147.459,"pebble_readpaginated_1k_ms":3.375,"pebble_writegrant_solo_ns_op":11108,"codec_direct_ns_op":451.5,"codec_reflect_ns_op":629.5,"sqlite_writepack_1k_ms":27.808},"status":"discard","description":"P1.4: bloom.FilterPolicy(10) on all levels. writepack_1m 3575.28→3678.77ms (+2.9%) — regression. Bloom filters add construction CPU on every flush/compaction; in fresh-sync the Get-before-Put always misses with no duplicates so the filter never short-circuits a real lookup, and the bench's read path uses range iterators not point Gets. Net cost only.","timestamp":1779685826808,"segment":0,"confidence":2.220915079267922,"asi":{"hypothesis":"bloom filters short-circuit the unconditional read-before-write Get → less work per PutGrantRecords call","result":"primary regressed +2.9%; bytes_op also up +0.5% (filter blocks on disk)","rollback_reason":"consistent regression across scales; bloom filters cost without benefit in this workload","mechanism_insight":"Two reasons bloom filters lose here: (1) fresh-sync workloads have unique external_ids so the Get-before-Put population is 100% misses — but the misses already short-circuit at the L0 file's index block, which is cached. Bloom filters just add a layer in front. (2) The bench's read path is range iteration via paginate.go, which scans key ranges and inherently checks every L0 file — blooms don't apply. They might help in C1 prod where multiple syncs of the same connector hit the per-app reader cache, but that's not measured here.","next_idea":"stop tuning Pebble knobs (axis is saturated at L0=8). Look at the pack phase. WritePack measures writes + final pack. The 'pack' step reads everything back and writes the c1z envelope. Profile that. Or: try larger SST block size for write throughput (P3.9 in backlog) — 64KiB blocks amortize header overhead at 1M scale. Also worth investigating: WriteOption.NoSync is already used in fresh-sync — verify that the per-batch commit path is actually hitting NoSync.","filter_overhead_visible":"writepack_1m_bytes_op 2108→2118 MB (+0.5%) confirms filter blocks land on disk"}}
{"run":9,"commit":"20a8ecd","metric":3584.484,"metrics":{"pebble_writepack_100k_ms":365.373,"pebble_writepack_10k_ms":46.406,"pebble_writepack_1k_ms":10.141,"pebble_writepack_100_ms":6.663,"pebble_writepack_1m_bytes_op":2097996408,"pebble_writepack_1m_allocs_op":9021714,"pebble_readpaginated_100k_ms":146.419,"pebble_readpaginated_1k_ms":3.329,"pebble_writegrant_solo_ns_op":11564,"codec_direct_ns_op":449.5,"codec_reflect_ns_op":1106,"sqlite_writepack_1k_ms":28.215},"status":"discard","description":"Pack step zstd SpeedDefault→SpeedFastest + WithEncoderConcurrency(0). 3575.28→3584.48ms (flat). The pack step is not a meaningful chunk of the 1M wallclock — Pebble's SSTs are already Snappy-compressed inside, so zstd over them is nearly a memcpy at any level.","timestamp":1779686219696,"segment":0,"confidence":6.924056503507313,"asi":{"hypothesis":"zstd SpeedDefault compressing 2 GB of Pebble files single-threaded is on the critical path","result":"flat — wrong hypothesis","rollback_reason":"no signal","mechanism_insight":"Pebble's SSTs store block-compressed data internally (Snappy at every level by Pebble default). The outer zstd over a tar of these files is nearly incompressible — zstd's level setting mostly trades CPU for finding patterns, but there are no patterns left to find. So SpeedFastest vs SpeedDefault is the same wallclock. WithEncoderConcurrency(0) does enable parallel encoding but only on large enough chunks; with io.Copy(tw, f) feeding the tar serially file-by-file, the parallelism doesn't engage much.","next_action_hint":"Need to instrument the bench to know where the 3.6 s actually goes. Three suspects: (a) the unconditional db.Get per grant in PutGrantRecords (≈1M ops, possibly several seconds amortized), (b) marshalRecord (proto marshal per grant), (c) batch.Set bytes-copying. Add per-phase timing prints in the bench inner loop, or use go test -cpuprofile then pprof top to localize. Also worth trying: skip the read-before-write Get when batch has no prior writes for that key (fresh-sync, first appearance). Need correctness analysis though.","where_pack_likely_sits":"<10% of total wallclock at 1M based on this null result"}}
{"run":10,"commit":"20a8ecd","metric":6562.587,"metrics":{"pebble_writepack_100k_ms":402.879,"pebble_writepack_10k_ms":48.762,"pebble_writepack_1k_ms":11.219,"pebble_writepack_100_ms":7.071,"pebble_writepack_1m_bytes_op":2106083824,"pebble_writepack_1m_allocs_op":10991025,"pebble_readpaginated_100k_ms":119.546,"pebble_readpaginated_1k_ms":3.568,"pebble_writegrant_solo_ns_op":11436,"codec_direct_ns_op":414,"codec_reflect_ns_op":579,"sqlite_writepack_1k_ms":27.58},"status":"discard","description":"Chunk PutGrantRecords into 16Ki batches to avoid flushable-batch sort. CATASTROPHIC: 3575→6562ms (+83%). Allocs +21%. The single-big-batch path was the optimized fast path: a batch larger than the memtable triggers Pebble's flushable-batch promotion, which sort.Sorts the batch once and then atomically swaps it in as a new memtable — zero re-write. Splitting forces conventional memtable rotation: 62 chunks → ~15 memtable flushes → exceeds L0CompactionThreshold=8 multiple times → compaction storm during writes.","timestamp":1779686606709,"segment":0,"confidence":2.0260326991962323,"asi":{"hypothesis":"split commits so each fits in memtable, avoiding the flushable-batch sort cost (1.1s in profile)","result":"+83% regression — the sort wasn't waste, it was the fast-path entry cost","rollback_reason":"catastrophic primary regression; profile misled — sort.Sort represents 22% of CPU but it gives Pebble the flushable-batch fast path which avoids the conventional flush→L0→compact loop entirely","key_lesson":"When Pebble sees Batch > MemTableSize, it flushable-batch-promotes: sort the batch once, swap it in as a memtable atomically. Total compaction work is the same downstream but the *writes* don't trigger N memtable rotations. Splitting batches turns one promotion into N rotations — which is much worse.","secondary_observations":"readpaginated_100k IMPROVED -18% (145→119ms). Interesting: with more L0 files due to more flushes, reads should be slower from L0 read amp. But the PREPARATION step in benchmarkRegisteredUnpackReadGrants writes the data, then re-opens read-only and walks pages. The chunked-write phase happened separately. The read win likely comes from compaction finishing more thoroughly between writes and reads in the chunked case (more L0→L1 work was done). Not transferable to writepack.","next_action_hint":"Reverse the chunking direction: try a LARGER memtable (128 MiB) to accommodate more of the 1M batch — still triggers flushable batch but fewer compaction rounds after. Or look at *what populates the batch* — maybe pre-sorting records by primary key would let the flushable batch sort take its pdqsort early-exit (already sorted detection). Note: bench data has external_id grant-NNNNNNNN which IS sorted by external_id, but the batch interleaves primary + 2 indexes, so the full key stream is unsorted.","alloc_regression_explanation":"+21% allocs from per-chunk batch.NewBatch + Close + 62x commit metadata"}}
